{
  "binding_type": "cadence-scheduler-binding",
  "recorded_at": "2026-06-02T20:23:43.455Z",
  "scheduler_state": "poll-later",
  "reason": "Cadence surfaces are fresh enough; no self-start is required right now.",
  "recommended_poll_interval_minutes": 60,
  "dispatch_command": "node ./src/cli.js cadence-dispatch --project . --stale-after-hours 24",
  "profiles": {
    "cron": {
      "schedule_expression": "0 * * * *",
      "command": "node ./src/cli.js cadence-dispatch --project . --stale-after-hours 24",
      "reason": "Use a recurring cron trigger to poll cadence-dispatch conservatively before the stale threshold."
    },
    "github_actions": {
      "cron_expression": "0 * * * *",
      "command": "node ./src/cli.js cadence-dispatch --project . --stale-after-hours 24",
      "reason": "Use a scheduled GitHub Actions workflow when the repository already relies on Actions for operational cadence."
    },
    "agent_loop": {
      "interval_minutes": 60,
      "command": "node ./src/cli.js cadence-dispatch --project . --stale-after-hours 24",
      "reason": "Use an always-on agent loop when cadence should stay close to the Orchestrator runtime."
    }
  },
  "recommended_next_check_at": "2026-06-03T19:05:13.611Z",
  "recommended_next_check_after_hours": 22.692,
  "source_session_id": "SESS-ORCH-001",
  "source_decision_record_id": "DEC-160"
}
